{"$schema":"https://json-schema.org/draft/2020-12/schema","$id":"sand-iam.consumer-acceptance-plan/v1","type":"object","additionalProperties":false,"required":["schema","profile","run_id","candidate","origins","gate_receipts","fixtures","fixture_scope_sha256","cleanup_manifest_sha256","live_credentials","steps"],"properties":{"schema":{"const":"sand-iam.consumer-acceptance-plan/v1"},"profile":{"const":"consumer_l04"},"run_id":{"$ref":"#/$defs/id"},"candidate":{"$ref":"#/$defs/candidate"},"origins":{"type":"object","additionalProperties":false,"required":["sandiam","consumer"],"properties":{"sandiam":{"$ref":"#/$defs/origin"},"consumer":{"$ref":"#/$defs/origin"}}},"gate_receipts":{"type":"object","additionalProperties":false,"required":["authorization_gate","fixture_ownership_gate","cleanup_gate"],"properties":{"authorization_gate":{"$ref":"#/$defs/receipt"},"fixture_ownership_gate":{"$ref":"#/$defs/receipt"},"cleanup_gate":{"$ref":"#/$defs/receipt"}}},"fixtures":{"type":"object","additionalProperties":false,"required":["organization_id","application_id","identity_id","business_object_id"],"properties":{"organization_id":{"$ref":"#/$defs/fixture"},"application_id":{"$ref":"#/$defs/fixture"},"identity_id":{"$ref":"#/$defs/fixture"},"business_object_id":{"$ref":"#/$defs/fixture"}}},"fixture_scope_sha256":{"$ref":"#/$defs/sha"},"cleanup_manifest_sha256":{"$ref":"#/$defs/sha"},"live_credentials":{"type":"object","additionalProperties":false,"required":["sandiam","consumer"],"properties":{"sandiam":{"$ref":"#/$defs/credential"},"consumer":{"$ref":"#/$defs/credential"}}},"steps":{"type":"array","minItems":6,"maxItems":6,"prefixItems":[{"$ref":"#/$defs/preflight"},{"$ref":"#/$defs/allow"},{"$ref":"#/$defs/deny"},{"$ref":"#/$defs/revoke"},{"$ref":"#/$defs/audit"},{"$ref":"#/$defs/cleanup"}],"items":false}},"$defs":{"sha":{"type":"string","pattern":"^[0-9a-f]{64}$"},"id":{"type":"string","pattern":"^[a-z][a-z0-9_-]{2,95}$"},"candidate":{"type":"object","additionalProperties":false,"required":["candidate_sha256","host_sha256","consumer_tree_sha256"],"properties":{"candidate_sha256":{"$ref":"#/$defs/sha"},"host_sha256":{"$ref":"#/$defs/sha"},"consumer_tree_sha256":{"$ref":"#/$defs/sha"}}},"origin":{"type":"string","pattern":"^(?:https://[a-z0-9]+(?:[a-z0-9.-]*[a-z0-9])?(?::(?:[1-9][0-9]{0,3}|[1-5][0-9]{4}|6[0-4][0-9]{3}|65[0-4][0-9]{2}|655[0-2][0-9]|6553[0-5]))?|http://127\\.0\\.0\\.1(?::(?:[1-9][0-9]{0,3}|[1-5][0-9]{4}|6[0-4][0-9]{3}|65[0-4][0-9]{2}|655[0-2][0-9]|6553[0-5]))?)$"},"receipt":{"type":"object","additionalProperties":false,"required":["id","run_id","candidate_sha256","host_sha256","consumer_tree_sha256","fixture_scope_sha256","cleanup_manifest_sha256"],"properties":{"id":{"$ref":"#/$defs/id"},"run_id":{"$ref":"#/$defs/id"},"candidate_sha256":{"$ref":"#/$defs/sha"},"host_sha256":{"$ref":"#/$defs/sha"},"consumer_tree_sha256":{"$ref":"#/$defs/sha"},"fixture_scope_sha256":{"$ref":"#/$defs/sha"},"cleanup_manifest_sha256":{"$ref":"#/$defs/sha"}}},"fixture":{"type":"string","pattern":"^consumer_l04_[a-z0-9_]{3,96}$"},"credential":{"type":"object","additionalProperties":false,"required":["secret_id","origin"],"properties":{"secret_id":{"type":"string","pattern":"^[A-Z][A-Z0-9_]{2,95}$"},"origin":{"$ref":"#/$defs/origin"}}},"preflight":{"type":"object","additionalProperties":false,"required":["id"],"properties":{"id":{"const":"preflight"}}},"allow":{"type":"object","additionalProperties":false,"required":["id"],"properties":{"id":{"const":"allow"}}},"deny":{"type":"object","additionalProperties":false,"required":["id"],"properties":{"id":{"const":"deny"}}},"revoke":{"type":"object","additionalProperties":false,"required":["id"],"properties":{"id":{"const":"revoke"}}},"audit":{"type":"object","additionalProperties":false,"required":["id"],"properties":{"id":{"const":"audit"}}},"cleanup":{"type":"object","additionalProperties":false,"required":["id"],"properties":{"id":{"const":"cleanup"}}}}}
