{"schema":"sand-iam.consumer-acceptance-plan/v1","profile":"consumer_l04","run_id":"consumer_l04_example","candidate":{"candidate_sha256":"1111111111111111111111111111111111111111111111111111111111111111","host_sha256":"2222222222222222222222222222222222222222222222222222222222222222","consumer_tree_sha256":"3333333333333333333333333333333333333333333333333333333333333333"},"origins":{"sandiam":"https://iam.example.test","consumer":"http://127.0.0.1:8088"},"gate_receipts":{"authorization_gate":{"id":"authorization_gate","run_id":"consumer_l04_example","candidate_sha256":"1111111111111111111111111111111111111111111111111111111111111111","host_sha256":"2222222222222222222222222222222222222222222222222222222222222222","consumer_tree_sha256":"3333333333333333333333333333333333333333333333333333333333333333","fixture_scope_sha256":"b87d28734497f74c3402b49d347fa55959b4c9fe945b70baee9364e7a72f7249","cleanup_manifest_sha256":"954ae954e385775649d31d8003b088b452bc9a1f3abb457743d63927c51e8ced"},"fixture_ownership_gate":{"id":"fixture_ownership_gate","run_id":"consumer_l04_example","candidate_sha256":"1111111111111111111111111111111111111111111111111111111111111111","host_sha256":"2222222222222222222222222222222222222222222222222222222222222222","consumer_tree_sha256":"3333333333333333333333333333333333333333333333333333333333333333","fixture_scope_sha256":"b87d28734497f74c3402b49d347fa55959b4c9fe945b70baee9364e7a72f7249","cleanup_manifest_sha256":"954ae954e385775649d31d8003b088b452bc9a1f3abb457743d63927c51e8ced"},"cleanup_gate":{"id":"cleanup_gate","run_id":"consumer_l04_example","candidate_sha256":"1111111111111111111111111111111111111111111111111111111111111111","host_sha256":"2222222222222222222222222222222222222222222222222222222222222222","consumer_tree_sha256":"3333333333333333333333333333333333333333333333333333333333333333","fixture_scope_sha256":"b87d28734497f74c3402b49d347fa55959b4c9fe945b70baee9364e7a72f7249","cleanup_manifest_sha256":"954ae954e385775649d31d8003b088b452bc9a1f3abb457743d63927c51e8ced"}},"fixtures":{"organization_id":"consumer_l04_organization","application_id":"consumer_l04_application","identity_id":"consumer_l04_identity","business_object_id":"consumer_l04_work_item"},"fixture_scope_sha256":"b87d28734497f74c3402b49d347fa55959b4c9fe945b70baee9364e7a72f7249","cleanup_manifest_sha256":"954ae954e385775649d31d8003b088b452bc9a1f3abb457743d63927c51e8ced","live_credentials":{"sandiam":{"secret_id":"SAND_IAM_ACCEPTANCE_TOKEN","origin":"https://iam.example.test"},"consumer":{"secret_id":"CONSUMER_ACCEPTANCE_TOKEN","origin":"http://127.0.0.1:8088"}},"steps":[{"id":"preflight"},{"id":"allow"},{"id":"deny"},{"id":"revoke"},{"id":"audit"},{"id":"cleanup"}]}
